{
  "suite_id": "baseline-v2.29.5",
  "provider": "mock",
  "model": "",
  "case_count": 61,
  "passed_count": 6,
  "failed_count": 55,
  "pass_rate": 0.098361,
  "results": [
    {
      "case_id": "pseudo-etymology",
      "run_dir": "runs/baseline-v2.29.5-pseudo-etymology",
      "result_path": "runs/baseline-v2.29.5-pseudo-etymology/eval-result.json",
      "passed": false,
      "finding_count": 3,
      "verification_status": "needs_human_review",
      "changed_line_ratio": 0.0,
      "char_delta_ratio": 0.0
    },
    {
      "case_id": "source-claim",
      "run_dir": "runs/baseline-v2.29.5-source-claim",
      "result_path": "runs/baseline-v2.29.5-source-claim/eval-result.json",
      "passed": false,
      "finding_count": 3,
      "verification_status": "needs_human_review",
      "changed_line_ratio": 0.0,
      "char_delta_ratio": 0.0
    },
    {
      "case_id": "register-shift",
      "run_dir": "runs/baseline-v2.29.5-register-shift",
      "result_path": "runs/baseline-v2.29.5-register-shift/eval-result.json",
      "passed": false,
      "finding_count": 3,
      "verification_status": "needs_human_review",
      "changed_line_ratio": 0.0,
      "char_delta_ratio": 0.0
    },
    {
      "case_id": "averintsev-adversarial",
      "run_dir": "runs/baseline-v2.29.5-averintsev-adversarial",
      "result_path": "runs/baseline-v2.29.5-averintsev-adversarial/eval-result.json",
      "passed": false,
      "finding_count": 2,
      "verification_status": "needs_human_review",
      "changed_line_ratio": 0.0,
      "char_delta_ratio": 0.0
    },
    {
      "case_id": "gasparov-meter-check",
      "run_dir": "runs/baseline-v2.29.5-gasparov-meter-check",
      "result_path": "runs/baseline-v2.29.5-gasparov-meter-check/eval-result.json",
      "passed": false,
      "finding_count": 2,
      "verification_status": "needs_human_review",
      "changed_line_ratio": 0.0,
      "char_delta_ratio": 0.0
    },
    {
      "case_id": "melchuk-syntax-check",
      "run_dir": "runs/baseline-v2.29.5-melchuk-syntax-check",
      "result_path": "runs/baseline-v2.29.5-melchuk-syntax-check/eval-result.json",
      "passed": false,
      "finding_count": 2,
      "verification_status": "needs_human_review",
      "changed_line_ratio": 0.0,
      "char_delta_ratio": 0.0
    },
    {
      "case_id": "poststructural-term-check",
      "run_dir": "runs/baseline-v2.29.5-poststructural-term-check",
      "result_path": "runs/baseline-v2.29.5-poststructural-term-check/eval-result.json",
      "passed": false,
      "finding_count": 1,
      "verification_status": "needs_human_review",
      "changed_line_ratio": 0.0,
      "char_delta_ratio": 0.0
    },
    {
      "case_id": "bakhtin-polyphony-check",
      "run_dir": "runs/baseline-v2.29.5-bakhtin-polyphony-check",
      "result_path": "runs/baseline-v2.29.5-bakhtin-polyphony-check/eval-result.json",
      "passed": false,
      "finding_count": 1,
      "verification_status": "needs_human_review",
      "changed_line_ratio": 0.0,
      "char_delta_ratio": 0.0
    },
    {
      "case_id": "iesh-sound-law",
      "run_dir": "runs/baseline-v2.29.5-iesh-sound-law",
      "result_path": "runs/baseline-v2.29.5-iesh-sound-law/eval-result.json",
      "passed": false,
      "finding_count": 2,
      "verification_status": "needs_human_review",
      "changed_line_ratio": 0.0,
      "char_delta_ratio": 0.0
    },
    {
      "case_id": "tsh-universal-check",
      "run_dir": "runs/baseline-v2.29.5-tsh-universal-check",
      "result_path": "runs/baseline-v2.29.5-tsh-universal-check/eval-result.json",
      "passed": false,
      "finding_count": 1,
      "verification_status": "needs_human_review",
      "changed_line_ratio": 0.0,
      "char_delta_ratio": 0.0
    },
    {
      "case_id": "pfg-field-boundary",
      "run_dir": "runs/baseline-v2.29.5-pfg-field-boundary",
      "result_path": "runs/baseline-v2.29.5-pfg-field-boundary/eval-result.json",
      "passed": false,
      "finding_count": 1,
      "verification_status": "needs_human_review",
      "changed_line_ratio": 0.0,
      "char_delta_ratio": 0.0
    },
    {
      "case_id": "nss-cliche-check",
      "run_dir": "runs/baseline-v2.29.5-nss-cliche-check",
      "result_path": "runs/baseline-v2.29.5-nss-cliche-check/eval-result.json",
      "passed": false,
      "finding_count": 1,
      "verification_status": "needs_human_review",
      "changed_line_ratio": 0.0,
      "char_delta_ratio": 0.0
    },
    {
      "case_id": "opoyaz-structural-clash",
      "run_dir": "runs/baseline-v2.29.5-opoyaz-structural-clash",
      "result_path": "runs/baseline-v2.29.5-opoyaz-structural-clash/eval-result.json",
      "passed": false,
      "finding_count": 1,
      "verification_status": "needs_human_review",
      "changed_line_ratio": 0.0,
      "char_delta_ratio": 0.0
    },
    {
      "case_id": "mythopoetics-symbol-check",
      "run_dir": "runs/baseline-v2.29.5-mythopoetics-symbol-check",
      "result_path": "runs/baseline-v2.29.5-mythopoetics-symbol-check/eval-result.json",
      "passed": false,
      "finding_count": 1,
      "verification_status": "needs_human_review",
      "changed_line_ratio": 0.0,
      "char_delta_ratio": 0.0
    },
    {
      "case_id": "narratology-plot-hole",
      "run_dir": "runs/baseline-v2.29.5-narratology-plot-hole",
      "result_path": "runs/baseline-v2.29.5-narratology-plot-hole/eval-result.json",
      "passed": false,
      "finding_count": 1,
      "verification_status": "needs_human_review",
      "changed_line_ratio": 0.0,
      "char_delta_ratio": 0.0
    },
    {
      "case_id": "reception-audience-neglect",
      "run_dir": "runs/baseline-v2.29.5-reception-audience-neglect",
      "result_path": "runs/baseline-v2.29.5-reception-audience-neglect/eval-result.json",
      "passed": false,
      "finding_count": 1,
      "verification_status": "needs_human_review",
      "changed_line_ratio": 0.0,
      "char_delta_ratio": 0.0
    },
    {
      "case_id": "zaliznyak-evidence-hierarchy",
      "run_dir": "runs/baseline-v2.29.5-zaliznyak-evidence-hierarchy",
      "result_path": "runs/baseline-v2.29.5-zaliznyak-evidence-hierarchy/eval-result.json",
      "passed": false,
      "finding_count": 2,
      "verification_status": "needs_human_review",
      "changed_line_ratio": 0.0,
      "char_delta_ratio": 0.0
    },
    {
      "case_id": "mss-semantic-loop",
      "run_dir": "runs/baseline-v2.29.5-mss-semantic-loop",
      "result_path": "runs/baseline-v2.29.5-mss-semantic-loop/eval-result.json",
      "passed": false,
      "finding_count": 1,
      "verification_status": "needs_human_review",
      "changed_line_ratio": 0.0,
      "char_delta_ratio": 0.0
    },
    {
      "case_id": "kmsh-concept-mix",
      "run_dir": "runs/baseline-v2.29.5-kmsh-concept-mix",
      "result_path": "runs/baseline-v2.29.5-kmsh-concept-mix/eval-result.json",
      "passed": false,
      "finding_count": 1,
      "verification_status": "needs_human_review",
      "changed_line_ratio": 0.0,
      "char_delta_ratio": 0.0
    },
    {
      "case_id": "dss-dialect-norm",
      "run_dir": "runs/baseline-v2.29.5-dss-dialect-norm",
      "result_path": "runs/baseline-v2.29.5-dss-dialect-norm/eval-result.json",
      "passed": false,
      "finding_count": 1,
      "verification_status": "needs_human_review",
      "changed_line_ratio": 0.0,
      "char_delta_ratio": 0.0
    },
    {
      "case_id": "mts-semiotic-blur",
      "run_dir": "runs/baseline-v2.29.5-mts-semiotic-blur",
      "result_path": "runs/baseline-v2.29.5-mts-semiotic-blur/eval-result.json",
      "passed": false,
      "finding_count": 1,
      "verification_status": "needs_human_review",
      "changed_line_ratio": 0.0,
      "char_delta_ratio": 0.0
    },
    {
      "case_id": "textology-copyist-error",
      "run_dir": "runs/baseline-v2.29.5-textology-copyist-error",
      "result_path": "runs/baseline-v2.29.5-textology-copyist-error/eval-result.json",
      "passed": false,
      "finding_count": 1,
      "verification_status": "needs_human_review",
      "changed_line_ratio": 0.0,
      "char_delta_ratio": 0.0
    },
    {
      "case_id": "hist-cult-anachronism",
      "run_dir": "runs/baseline-v2.29.5-hist-cult-anachronism",
      "result_path": "runs/baseline-v2.29.5-hist-cult-anachronism/eval-result.json",
      "passed": false,
      "finding_count": 1,
      "verification_status": "needs_human_review",
      "changed_line_ratio": 0.0,
      "char_delta_ratio": 0.0
    },
    {
      "case_id": "poststruct-deconstruction-loop",
      "run_dir": "runs/baseline-v2.29.5-poststruct-deconstruction-loop",
      "result_path": "runs/baseline-v2.29.5-poststruct-deconstruction-loop/eval-result.json",
      "passed": false,
      "finding_count": 1,
      "verification_status": "needs_human_review",
      "changed_line_ratio": 0.0,
      "char_delta_ratio": 0.0
    },
    {
      "case_id": "averintsev-epistemic-caution",
      "run_dir": "runs/baseline-v2.29.5-averintsev-epistemic-caution",
      "result_path": "runs/baseline-v2.29.5-averintsev-epistemic-caution/eval-result.json",
      "passed": false,
      "finding_count": 1,
      "verification_status": "needs_human_review",
      "changed_line_ratio": 0.0,
      "char_delta_ratio": 0.0
    },
    {
      "case_id": "gasparov-fact-check",
      "run_dir": "runs/baseline-v2.29.5-gasparov-fact-check",
      "result_path": "runs/baseline-v2.29.5-gasparov-fact-check/eval-result.json",
      "passed": false,
      "finding_count": 1,
      "verification_status": "needs_human_review",
      "changed_line_ratio": 0.0,
      "char_delta_ratio": 0.0
    },
    {
      "case_id": "melchuk-formalism-check",
      "run_dir": "runs/baseline-v2.29.5-melchuk-formalism-check",
      "result_path": "runs/baseline-v2.29.5-melchuk-formalism-check/eval-result.json",
      "passed": false,
      "finding_count": 1,
      "verification_status": "needs_human_review",